{
	"name":"activemq",
	"description":"ActiveMQ Client Deployment Recipe",
	"phases":["deploy"],
	"bundles":{
		"install":[
			{ "location":"https://repo1.maven.org/maven2/org/apache/geronimo/specs/geronimo-j2ee-management_1.1_spec/1.0.1/geronimo-j2ee-management_1.1_spec-1.0.1.jar" },
			{ "location":"https://repo1.maven.org/maven2/org/fusesource/hawtbuf/hawtbuf/1.11/hawtbuf-1.11.jar" },
			{ "location":"https://repo1.maven.org/maven2/org/apache/activemq/activemq-client/5.15.11/activemq-client-5.15.11.jar" }
		]
	}
}